{
  "$schema": "../palette.schema.json",
  "schemaVersion": "1.0",
  "id": "hama-midi",
  "label": "Hama Midi",
  "brand": "Hama",
  "standard": "midi",
  "beadSizeMm": 5,
  "quality": "community-legacy",
  "source": "maxcleme/beadcolors gen/v1/hama.csv(MIT) 主数据；beadmachine colors_hama.json(MIT) + hank beads.hex.txt(MIT) 交叉核对",
  "license": "MIT",
  "licenseNote": "数据段复制自 MIT 项目并保留上游版权声明；快照与 SHA-256 见 data/provenance/",
  "codeStyle": {
    "stripLeadingBrandChar": false,
    "zeroPad": 2
  },
  "notes": "hex 为工程近似色，与实物存在色差；图纸以 code 为准。透明/半透明色默认不参与自动匹配。",
  "colors": [
    {
      "code": "H01",
      "nameEn": "White",
      "hex": "#E5ECF1",
      "rgb": [
        229,
        236,
        241
      ],
      "kind": "solid",
      "family": "H",
      "sortKey": 1
    },
    {
      "code": "H02",
      "nameEn": "Cream",
      "hex": "#E4E4C5",
      "rgb": [
        228,
        228,
        197
      ],
      "kind": "solid",
      "family": "H",
      "sortKey": 2
    },
    {
      "code": "H03",
      "nameEn": "Yellow",
      "hex": "#E9C704",
      "rgb": [
        233,
        199,
        4
      ],
      "kind": "solid",
      "family": "H",
      "sortKey": 3
    },
    {
      "code": "H04",
      "nameEn": "Orange",
      "hex": "#D14803",
      "rgb": [
        209,
        72,
        3
      ],
      "kind": "solid",
      "family": "H",
      "sortKey": 4
    },
    {
      "code": "H05",
      "nameEn": "Red",
      "hex": "#B4060E",
      "rgb": [
        180,
        6,
        14
      ],
      "kind": "solid",
      "family": "H",
      "sortKey": 5
    },
    {
      "code": "H06",
      "nameEn": "Pink",
      "hex": "#EA8AA5",
      "rgb": [
        234,
        138,
        165
      ],
      "kind": "solid",
      "family": "H",
      "sortKey": 6
    },
    {
      "code": "H07",
      "nameEn": "Purple",
      "hex": "#712297",
      "rgb": [
        113,
        34,
        151
      ],
      "kind": "solid",
      "family": "H",
      "sortKey": 7
    },
    {
      "code": "H08",
      "nameEn": "Blue",
      "hex": "#0239A3",
      "rgb": [
        2,
        57,
        163
      ],
      "kind": "solid",
      "family": "H",
      "sortKey": 8
    },
    {
      "code": "H09",
      "nameEn": "Light Blue",
      "hex": "#025BC3",
      "rgb": [
        2,
        91,
        195
      ],
      "kind": "solid",
      "family": "H",
      "sortKey": 9
    },
    {
      "code": "H10",
      "nameEn": "Green",
      "hex": "#027643",
      "rgb": [
        2,
        118,
        67
      ],
      "kind": "solid",
      "family": "H",
      "sortKey": 10
    },
    {
      "code": "H11",
      "nameEn": "Light Green",
      "hex": "#19CDA7",
      "rgb": [
        25,
        205,
        167
      ],
      "kind": "solid",
      "family": "H",
      "sortKey": 11
    },
    {
      "code": "H12",
      "nameEn": "Brown",
      "hex": "#3E271A",
      "rgb": [
        62,
        39,
        26
      ],
      "kind": "solid",
      "family": "H",
      "sortKey": 12
    },
    {
      "code": "H13",
      "nameEn": "Transparent Red",
      "hex": "#C02435",
      "rgb": [
        192,
        36,
        53
      ],
      "kind": "special",
      "family": "H",
      "sortKey": 13
    },
    {
      "code": "H14",
      "nameEn": "Transparent Yellow",
      "hex": "#E4AA32",
      "rgb": [
        228,
        170,
        50
      ],
      "kind": "special",
      "family": "H",
      "sortKey": 14
    },
    {
      "code": "H16",
      "nameEn": "Transparent Green",
      "hex": "#37B876",
      "rgb": [
        55,
        184,
        118
      ],
      "kind": "special",
      "family": "H",
      "sortKey": 15
    },
    {
      "code": "H17",
      "nameEn": "Grey",
      "hex": "#838F98",
      "rgb": [
        131,
        143,
        152
      ],
      "kind": "solid",
      "family": "H",
      "sortKey": 16
    },
    {
      "code": "H18",
      "nameEn": "Black",
      "hex": "#141315",
      "rgb": [
        20,
        19,
        21
      ],
      "kind": "solid",
      "family": "H",
      "sortKey": 17
    },
    {
      "code": "H19",
      "nameEn": "Clear",
      "hex": "#D8D2CE",
      "rgb": [
        216,
        210,
        206
      ],
      "kind": "transparent",
      "family": "H",
      "sortKey": 18
    },
    {
      "code": "H20",
      "nameEn": "Reddish Brown",
      "hex": "#8D2A0F",
      "rgb": [
        141,
        42,
        15
      ],
      "kind": "solid",
      "family": "H",
      "sortKey": 19
    },
    {
      "code": "H21",
      "nameEn": "Light Brown",
      "hex": "#BE6C21",
      "rgb": [
        190,
        108,
        33
      ],
      "kind": "solid",
      "family": "H",
      "sortKey": 20
    },
    {
      "code": "H22",
      "nameEn": "Dark Red",
      "hex": "#91020A",
      "rgb": [
        145,
        2,
        10
      ],
      "kind": "solid",
      "family": "H",
      "sortKey": 21
    },
    {
      "code": "H24",
      "nameEn": "Translucent Purple",
      "hex": "#683E9A",
      "rgb": [
        104,
        62,
        154
      ],
      "kind": "special",
      "family": "H",
      "sortKey": 22
    },
    {
      "code": "H25",
      "nameEn": "Translucent Brown",
      "hex": "#87593D",
      "rgb": [
        135,
        89,
        61
      ],
      "kind": "special",
      "family": "H",
      "sortKey": 23
    },
    {
      "code": "H26",
      "nameEn": "Matt Rose",
      "hex": "#E8A498",
      "rgb": [
        232,
        164,
        152
      ],
      "kind": "solid",
      "family": "H",
      "sortKey": 24
    },
    {
      "code": "H27",
      "nameEn": "Beige",
      "hex": "#DCB18E",
      "rgb": [
        220,
        177,
        142
      ],
      "kind": "solid",
      "family": "H",
      "sortKey": 25
    },
    {
      "code": "H28",
      "nameEn": "Dark Green",
      "hex": "#1E2C1C",
      "rgb": [
        30,
        44,
        28
      ],
      "kind": "solid",
      "family": "H",
      "sortKey": 26
    },
    {
      "code": "H29",
      "nameEn": "Claret",
      "hex": "#BF0142",
      "rgb": [
        191,
        1,
        66
      ],
      "kind": "solid",
      "family": "H",
      "sortKey": 27
    },
    {
      "code": "H30",
      "nameEn": "Burgundy",
      "hex": "#4E0C1B",
      "rgb": [
        78,
        12,
        27
      ],
      "kind": "solid",
      "family": "H",
      "sortKey": 28
    },
    {
      "code": "H31",
      "nameEn": "Turquoise",
      "hex": "#489AB9",
      "rgb": [
        72,
        154,
        185
      ],
      "kind": "solid",
      "family": "H",
      "sortKey": 29
    },
    {
      "code": "H32",
      "nameEn": "Neon Fuchsia",
      "hex": "#FF208D",
      "rgb": [
        255,
        32,
        141
      ],
      "kind": "solid",
      "family": "H",
      "sortKey": 30
    },
    {
      "code": "H33",
      "nameEn": "Cerise",
      "hex": "#FF3956",
      "rgb": [
        255,
        57,
        86
      ],
      "kind": "solid",
      "family": "H",
      "sortKey": 31
    },
    {
      "code": "H34",
      "nameEn": "Neon Yellow",
      "hex": "#E5EF13",
      "rgb": [
        229,
        239,
        19
      ],
      "kind": "solid",
      "family": "H",
      "sortKey": 32
    },
    {
      "code": "H35",
      "nameEn": "Neon Red",
      "hex": "#FF2833",
      "rgb": [
        255,
        40,
        51
      ],
      "kind": "solid",
      "family": "H",
      "sortKey": 33
    },
    {
      "code": "H36",
      "nameEn": "Neon Blue",
      "hex": "#2353B0",
      "rgb": [
        35,
        83,
        176
      ],
      "kind": "solid",
      "family": "H",
      "sortKey": 34
    },
    {
      "code": "H37",
      "nameEn": "Neon Green",
      "hex": "#06B73C",
      "rgb": [
        6,
        183,
        60
      ],
      "kind": "solid",
      "family": "H",
      "sortKey": 35
    },
    {
      "code": "H38",
      "nameEn": "Neon Orange",
      "hex": "#FD8600",
      "rgb": [
        253,
        134,
        0
      ],
      "kind": "solid",
      "family": "H",
      "sortKey": 36
    },
    {
      "code": "H39",
      "nameEn": "Fluorescent Yellow",
      "hex": "#F1F21C",
      "rgb": [
        241,
        242,
        28
      ],
      "kind": "solid",
      "family": "H",
      "sortKey": 37
    },
    {
      "code": "H40",
      "nameEn": "Fluorescent Orange",
      "hex": "#FE630B",
      "rgb": [
        254,
        99,
        11
      ],
      "kind": "solid",
      "family": "H",
      "sortKey": 38
    },
    {
      "code": "H41",
      "nameEn": "Fluorescent Blue",
      "hex": "#2659B2",
      "rgb": [
        38,
        89,
        178
      ],
      "kind": "solid",
      "family": "H",
      "sortKey": 39
    },
    {
      "code": "H42",
      "nameEn": "Fluorescent Green",
      "hex": "#0CBD51",
      "rgb": [
        12,
        189,
        81
      ],
      "kind": "solid",
      "family": "H",
      "sortKey": 40
    },
    {
      "code": "H43",
      "nameEn": "Pastel Yellow",
      "hex": "#E7E45A",
      "rgb": [
        231,
        228,
        90
      ],
      "kind": "solid",
      "family": "H",
      "sortKey": 41
    },
    {
      "code": "H44",
      "nameEn": "Pastel Red",
      "hex": "#F96160",
      "rgb": [
        249,
        97,
        96
      ],
      "kind": "solid",
      "family": "H",
      "sortKey": 42
    },
    {
      "code": "H45",
      "nameEn": "Pastel Purple",
      "hex": "#8E69CD",
      "rgb": [
        142,
        105,
        205
      ],
      "kind": "solid",
      "family": "H",
      "sortKey": 43
    },
    {
      "code": "H46",
      "nameEn": "Pastel Blue",
      "hex": "#51AEE4",
      "rgb": [
        81,
        174,
        228
      ],
      "kind": "solid",
      "family": "H",
      "sortKey": 44
    },
    {
      "code": "H47",
      "nameEn": "Pastel Green",